      1 0.000000    192.168.2.9           128.119.245.12        HTTP     518    GET /wireshark-labs/HTTP-wireshark-file4.html HTTP/1.1 

Frame 1: 518 bytes on wire (4144 bits), 518 bytes captured (4144 bits)
Ethernet II, Src: HonHaiPr_c1:6b:ad (10:08:b1:c1:6b:ad), Dst: BelkinIn_98:a4:90 (ec:1a:59:98:a4:90)
Internet Protocol Version 4, Src: 192.168.2.9 (192.168.2.9), Dst: 128.119.245.12 (128.119.245.12)
Transmission Control Protocol, Src Port: 48402 (48402), Dst Port: 80 (80), Seq: 1, Ack: 1, Len: 452
Hypertext Transfer Protocol
    GET /wireshark-labs/HTTP-wireshark-file4.html HTTP/1.1\r\n
    Host: gaia.cs.umass.edu\r\n
    Connection: keep-alive\r\n
    Pragma: no-cache\r\n
    Cache-Control: no-cache\r\n
    Accept: text/html,application/xhtml+xml,application/xml;q=0.9,image/webp,*/*;q=0.8\r\n
    User-Agent: Mozilla/5.0 (X11; Linux x86_64) AppleWebKit/537.36 (KHTML, like Gecko) Ubuntu Chromium/37.0.2062.120 Chrome/37.0.2062.120 Safari/537.36\r\n
    Accept-Encoding: gzip,deflate,sdch\r\n
    Accept-Language: en-US,en;q=0.8\r\n
    \r\n
    [Full request URI: http://gaia.cs.umass.edu/wireshark-labs/HTTP-wireshark-file4.html]
    [HTTP request 1/1]
    [Response in frame: 2]

      2 0.018701    128.119.245.12        192.168.2.9           HTTP     1168   HTTP/1.1 200 OK  (text/html)

Frame 2: 1168 bytes on wire (9344 bits), 1168 bytes captured (9344 bits)
Ethernet II, Src: BelkinIn_98:a4:90 (ec:1a:59:98:a4:90), Dst: HonHaiPr_c1:6b:ad (10:08:b1:c1:6b:ad)
Internet Protocol Version 4, Src: 128.119.245.12 (128.119.245.12), Dst: 192.168.2.9 (192.168.2.9)
Transmission Control Protocol, Src Port: 80 (80), Dst Port: 48402 (48402), Seq: 1, Ack: 453, Len: 1102
Hypertext Transfer Protocol
    HTTP/1.1 200 OK\r\n
    Date: Tue, 13 Oct 2015 15:41:41 GMT\r\n
    Server: Apache/2.4.6 (CentOS) OpenSSL/1.0.1e-fips PHP/5.4.16 mod_perl/2.0.9dev Perl/v5.16.3\r\n
    Last-Modified: Tue, 13 Oct 2015 05:59:01 GMT\r\n
    ETag: "2e5-521f6247cf92c"\r\n
    Accept-Ranges: bytes\r\n
    Content-Length: 741\r\n
    Keep-Alive: timeout=5, max=100\r\n
    Connection: Keep-Alive\r\n
    Content-Type: text/html; charset=UTF-8\r\n
    \r\n
    [HTTP response 1/1]
    [Time since request: 0.018701000 seconds]
    [Request in frame: 1]
Line-based text data: text/html

      3 0.271070    192.168.2.9           128.119.240.90        HTTP     525    GET /~kurose/cover_5th_ed.jpg HTTP/1.1 

Frame 3: 525 bytes on wire (4200 bits), 525 bytes captured (4200 bits)
Ethernet II, Src: HonHaiPr_c1:6b:ad (10:08:b1:c1:6b:ad), Dst: BelkinIn_98:a4:90 (ec:1a:59:98:a4:90)
Internet Protocol Version 4, Src: 192.168.2.9 (192.168.2.9), Dst: 128.119.240.90 (128.119.240.90)
Transmission Control Protocol, Src Port: 42886 (42886), Dst Port: 80 (80), Seq: 1, Ack: 1, Len: 459
Hypertext Transfer Protocol
    GET /~kurose/cover_5th_ed.jpg HTTP/1.1\r\n
    Host: manic.cs.umass.edu\r\n
    Connection: keep-alive\r\n
    Pragma: no-cache\r\n
    Cache-Control: no-cache\r\n
    Accept: image/webp,*/*;q=0.8\r\n
    User-Agent: Mozilla/5.0 (X11; Linux x86_64) AppleWebKit/537.36 (KHTML, like Gecko) Ubuntu Chromium/37.0.2062.120 Chrome/37.0.2062.120 Safari/537.36\r\n
    Referer: http://gaia.cs.umass.edu/wireshark-labs/HTTP-wireshark-file4.html\r\n
    Accept-Encoding: gzip,deflate,sdch\r\n
    Accept-Language: en-US,en;q=0.8\r\n
    \r\n
    [Full request URI: http://manic.cs.umass.edu/~kurose/cover_5th_ed.jpg]
    [HTTP request 1/1]
    [Response in frame: 4]

      4 0.288352    128.119.240.90        192.168.2.9           HTTP     522    HTTP/1.1 302 Found  (text/html)

Frame 4: 522 bytes on wire (4176 bits), 522 bytes captured (4176 bits)
Ethernet II, Src: BelkinIn_98:a4:90 (ec:1a:59:98:a4:90), Dst: HonHaiPr_c1:6b:ad (10:08:b1:c1:6b:ad)
Internet Protocol Version 4, Src: 128.119.240.90 (128.119.240.90), Dst: 192.168.2.9 (192.168.2.9)
Transmission Control Protocol, Src Port: 80 (80), Dst Port: 42886 (42886), Seq: 1, Ack: 460, Len: 456
Hypertext Transfer Protocol
    HTTP/1.1 302 Found\r\n
    Date: Tue, 13 Oct 2015 15:41:41 GMT\r\n
    Server: Apache\r\n
    Location: http://caite.cs.umass.edu/~kurose/cover_5th_ed.jpg\r\n
    Content-Length: 234\r\n
    Connection: close\r\n
    Content-Type: text/html; charset=iso-8859-1\r\n
    \r\n
    [HTTP response 1/1]
    [Time since request: 0.017282000 seconds]
    [Request in frame: 3]
Line-based text data: text/html

      5 0.295224    192.168.2.9           165.193.140.14        HTTP     566    GET /assets/hip/us/hip_us_pearsonhighered/images/pearson_logo.gif HTTP/1.1 

Frame 5: 566 bytes on wire (4528 bits), 566 bytes captured (4528 bits)
Ethernet II, Src: HonHaiPr_c1:6b:ad (10:08:b1:c1:6b:ad), Dst: BelkinIn_98:a4:90 (ec:1a:59:98:a4:90)
Internet Protocol Version 4, Src: 192.168.2.9 (192.168.2.9), Dst: 165.193.140.14 (165.193.140.14)
Transmission Control Protocol, Src Port: 56764 (56764), Dst Port: 80 (80), Seq: 1, Ack: 1, Len: 500
Hypertext Transfer Protocol
    GET /assets/hip/us/hip_us_pearsonhighered/images/pearson_logo.gif HTTP/1.1\r\n
    Host: www.pearsonhighered.com\r\n
    Connection: keep-alive\r\n
    Pragma: no-cache\r\n
    Cache-Control: no-cache\r\n
    Accept: image/webp,*/*;q=0.8\r\n
    User-Agent: Mozilla/5.0 (X11; Linux x86_64) AppleWebKit/537.36 (KHTML, like Gecko) Ubuntu Chromium/37.0.2062.120 Chrome/37.0.2062.120 Safari/537.36\r\n
    Referer: http://gaia.cs.umass.edu/wireshark-labs/HTTP-wireshark-file4.html\r\n
    Accept-Encoding: gzip,deflate,sdch\r\n
    Accept-Language: en-US,en;q=0.8\r\n
    \r\n
    [Full request URI: http://www.pearsonhighered.com/assets/hip/us/hip_us_pearsonhighered/images/pearson_logo.gif]
    [HTTP request 1/1]

      6 0.352544    192.168.2.9           128.119.240.90        HTTP     525    GET /~kurose/cover_5th_ed.jpg HTTP/1.1 

Frame 6: 525 bytes on wire (4200 bits), 525 bytes captured (4200 bits)
Ethernet II, Src: HonHaiPr_c1:6b:ad (10:08:b1:c1:6b:ad), Dst: BelkinIn_98:a4:90 (ec:1a:59:98:a4:90)
Internet Protocol Version 4, Src: 192.168.2.9 (192.168.2.9), Dst: 128.119.240.90 (128.119.240.90)
Transmission Control Protocol, Src Port: 42888 (42888), Dst Port: 80 (80), Seq: 1, Ack: 1, Len: 459
Hypertext Transfer Protocol
    GET /~kurose/cover_5th_ed.jpg HTTP/1.1\r\n
    Host: caite.cs.umass.edu\r\n
    Connection: keep-alive\r\n
    Pragma: no-cache\r\n
    Cache-Control: no-cache\r\n
    Accept: image/webp,*/*;q=0.8\r\n
    User-Agent: Mozilla/5.0 (X11; Linux x86_64) AppleWebKit/537.36 (KHTML, like Gecko) Ubuntu Chromium/37.0.2062.120 Chrome/37.0.2062.120 Safari/537.36\r\n
    Referer: http://gaia.cs.umass.edu/wireshark-labs/HTTP-wireshark-file4.html\r\n
    Accept-Encoding: gzip,deflate,sdch\r\n
    Accept-Language: en-US,en;q=0.8\r\n
    \r\n
    [Full request URI: http://caite.cs.umass.edu/~kurose/cover_5th_ed.jpg]
    [HTTP request 1/1]
